{"$schema":"https://json-schema.org/draft/2020-12/schema","title":"Restaurantes","type":"array","items":{"type":"object","required":["destination","restaurants","streetFood","cafes","bars","rooftops","nightlife","typicalDishes","priceRange"],"properties":{"destination":{"type":"string"},"restaurants":{"type":"array","items":{"type":"string"}},"streetFood":{"type":"array","items":{"type":"string"}},"cafes":{"type":"array","items":{"type":"string"}},"bars":{"type":"array","items":{"type":"string"}},"rooftops":{"type":"array","items":{"type":"string"}},"nightlife":{"type":"array","items":{"type":"string"}},"typicalDishes":{"type":"array","items":{"type":"string"}},"priceRange":{"type":"string"}}}}
