[
  { "destination": "Bangkok", "restaurants": ["Puestos de Chinatown", "Restaurantes tailandeses en Old Town"], "streetFood": ["Marisco en Yaowarat", "Pad thai", "Mango sticky rice"], "cafes": ["Cafés de Talat Noi"], "bars": ["Rooftops", "Khao San Road"], "rooftops": ["Sky bar por decidir"], "nightlife": ["Sukhumvit", "Khao San"], "typicalDishes": ["Pad kra pao", "Boat noodles", "Tom yum"], "priceRange": "2-25 EUR" },
  { "destination": "Chiang Mai", "restaurants": ["Locales de khao soi", "Puestos del Night Bazaar"], "streetFood": ["Sai ua", "Khao soi"], "cafes": ["Cafés de Nimman"], "bars": ["Nimman", "Old City"], "rooftops": [], "nightlife": ["Night Bazaar"], "typicalDishes": ["Khao soi", "Sai ua", "Nam prik ong"], "priceRange": "2-18 EUR" },
  { "destination": "Koh Tao", "restaurants": ["Restaurantes tailandeses de playa", "Cafés de buceo"], "streetFood": ["Tortitas", "Brochetas a la parrilla"], "cafes": ["Cafés de Sairee"], "bars": ["Bares de playa"], "rooftops": [], "nightlife": ["Playa Sairee"], "typicalDishes": ["Curries tailandeses", "Marisco fresco"], "priceRange": "4-25 EUR" },
  { "destination": "Krabi", "restaurants": ["Marisco en Ao Nang", "Krabi Town"], "streetFood": ["Snacks de mercado nocturno"], "cafes": ["Cafés de Ao Nang"], "bars": ["Bares de playa"], "rooftops": [], "nightlife": ["Ao Nang"], "typicalDishes": ["Marisco", "Massaman curry"], "priceRange": "3-25 EUR" },
  { "destination": "Phi Phi", "restaurants": ["Sitios informales en Tonsai"], "streetFood": ["Pancakes tailandeses", "Noodles"], "cafes": ["Cafés de la isla"], "bars": ["Bares de playa", "Fire shows"], "rooftops": [], "nightlife": ["Loh Dalum"], "typicalDishes": ["Marisco", "Arroz frito"], "priceRange": "5-30 EUR" }
]
